"* This class manages the windows for the application.  *  * TODO: Correct these notes  * <p>When a session closes the window manager will ensure that  * all of the windows for that sesion are closed.  * <p>Similarily when a window is closed the windows manager will ensure that  * references to the window are removed for the session.  *  * JASON: Prior to this patch there was some code movement from this class to  * Sessionmanager. The idea being that Sessionmanager was the controller.  * Do we still want to do this? Remember in the future there will probably be  * an SDI as well as MDI version of the windows.  *  * @author <A HREF=""mailto:colbell@users.sourceforge.net"">Colin Bell</A>  * @author <A HREF=""mailto:jmheight@users.sourceforge.net"">Jason Height</A>";app/src/net/sourceforge/squirrel_sql/client/gui/WindowManager.java;60-76;
TODO: Allow the user to specify the sequence name for dialects that don't natively support;plugins/refactoring/src/net/sourceforge/squirrel_sql/plugins/refactoring/commands/AddAutoIncrementCommand.java;109;
TODO : This test passes on Windows but fails on Linux with a;test/src/net/sourceforge/squirrel_sql/fw/util/FileTest.java;666;
Hack to deal with Axion AXION_* tables.;plugins/dbcopy/test/net/sourceforge/squirrel_sql/plugins/dbcopy/MockSessionInfoProvider.java;138;
better safe than sorry!;fw/src/net/sourceforge/squirrel_sql/fw/datasetviewer/CellImportExportInfoSaver.java;140;
without limiting it, and do that read if needed.  If there is a problem during the;fw/src/net/sourceforge/squirrel_sql/fw/datasetviewer/MyTableModel.java;57;
TODO: Should have session listeners instead of these calls.;app/src/net/sourceforge/squirrel_sql/client/session/SessionManager.java;279;
isEditableXXX() methods in this class is to say that the column;fw/src/net/sourceforge/squirrel_sql/fw/datasetviewer/cellcomponent/CellComponentFactory.java;617;
TODO: Delete Me;app/src/net/sourceforge/squirrel_sql/client/session/SessionFactory.java;20;
right of the selected tab is selected.  This is a work-around for;app/src/net/sourceforge/squirrel_sql/client/session/mainpanel/objecttree/ObjectTreeTabbedPane.java;120;
* TODO: This should not be public. Check all usages of it  * and put appropriate methods in an API object.;app/src/net/sourceforge/squirrel_sql/client/gui/session/SessionPanel.java;215-218;
TODO: create the child index ST;fw/src/net/sourceforge/squirrel_sql/fw/dialects/SybaseDialectExt.java;546;
* SQLFilterAction.java  *  * Created on March 22, 2003, 10:55 AM  *  * Adapted from SessionPropertiesAction.java by Colin Bell.  *  * TODO: CHange name to ContentsTabFilterAction;app/src/net/sourceforge/squirrel_sql/client/session/action/SQLFilterAction.java;35-43;
"* This <CODE>ICommand</CODE> displays a dialog box that allows the user to  * enter a 'where' clause or an 'order by' clause used when getting data via  * the 'Contents' tab.  *  * @author <A HREF=""mailto:mjhammel@users.sourceforge.net"">Maury Hammel</A>  *  * TODO: Change name to ContentsTabFilterCommand";app/src/net/sourceforge/squirrel_sql/client/session/action/SQLFilterCommand.java;29-37;
TODO: ? Dialog Handling on Cancelled ?;plugins/postgres/src/net/sourceforge/squirrel_sql/plugins/postgres/commands/handler/MessageSQLExecuterHandler.java;92;
TODO: consider filing a bug report against Axion build M3.;fw/src/net/sourceforge/squirrel_sql/fw/dialects/AxionDialectExt.java;56;
Hack to deal with Sybase's sys tables;plugins/dbcopy/test/net/sourceforge/squirrel_sql/plugins/dbcopy/MockSessionInfoProvider.java;148;
TODO: When message are can have some text in red (error);plugins/sqlval/src/net/sourceforge/squirrel_sql/plugins/sqlval/cmd/ValidateSQLCommand.java;98;
* TODO: Delete this class - unused;plugins/mysql/src/net/sourceforge/squirrel_sql/plugins/mysql/gui/AlterTablePanelBuilder.java;04/jun;
Total Hack! Type OTHER(1111) can be other types as well?;fw/src/net/sourceforge/squirrel_sql/fw/dialects/OracleDialectExt.java;82;
// used earlier. We use this little (ugly) trick to keep users being confused by;app/src/net/sourceforge/squirrel_sql/client/session/properties/SessionProperties.java;812;
this problem until I can determine why the DatabaseObjectInfoTab;app/src/net/sourceforge/squirrel_sql/client/session/mainpanel/objecttree/ObjectTreeTabbedPane.java;121;
TODO verify this is correct;fw/src/net/sourceforge/squirrel_sql/fw/dialects/HSQLDialectExt.java;980;
TODO: Put throws clause back in;app/src/net/sourceforge/squirrel_sql/client/plugin/DefaultPlugin.java;78;
"* A dialect delegate for the TimesTen database.  * TODO: This dialect is not yet complete.  Need to provide implementations wherever ""Not yet implemented""  * appears.";fw/src/net/sourceforge/squirrel_sql/fw/dialects/TimesTenDialectExt.java;34-38;
TODO: just noticed that MySQL 5.0 supports a multi-bit BIT;plugins/dbcopy/src/net/sourceforge/squirrel_sql/plugins/dbcopy/util/DBUtil.java;808;
// called so we've used a workaround. The workaround doesn't work in;app/src/net/sourceforge/squirrel_sql/client/gui/db/BaseListInternalFrame.java;221;
* TODO: This shouldn't be public. Its only been done for the JComplete  * plugin. At some stage this method will be returned to package visibility.;app/src/net/sourceforge/squirrel_sql/client/gui/session/SessionPanel.java;361-364;
TODO: new feature could be to examine table list for FK's;plugins/dbcopy/src/net/sourceforge/squirrel_sql/plugins/dbcopy/CopyExecutor.java;207;
alt may not work. This code is a workaround. See bug report;app/src/net/sourceforge/squirrel_sql/client/gui/mainframe/MainFrame.java;402;
though this is a hack, it doesn't seem to negatively impact;plugins/oracle/src/net/sourceforge/squirrel_sql/plugins/oracle/OraclePlugin.java;824;
TODO need to implement or change the message;fw/src/net/sourceforge/squirrel_sql/fw/dialects/InterbaseDialectExt.java;440;
TODO: What about these;plugins/laf/src/net/sourceforge/squirrel_sql/plugins/laf/LAFRegister.java;60;
